{
  "$version": "1.0",
  "$schema": "./registry_schemes.schema.json",
  "updated_at": "2025-01-01",
  "description": "Registry of government schemes, programmes, missions, and funds. IDs are permanently stable. active=false + archived=true for historical resolution of dissolved schemes. v1.0: sector field now references FUNC-* IDs from registry_entities.json function_vocabulary (was free string). administering_entity_id validated against registry_entities.json (pipeline enforced). legislation field now uses legislation_code format e.g. ACT-NREGA-2005 for machine-resolveability.",
  "id_convention": {
    "description": "ID prefix encodes jurisdiction. IDs must match pattern ^[A-Z0-9][A-Z0-9\\-]+[A-Z0-9]$",
    "prefixes": [
      { "prefix": "GOI-SCH", "meaning": "Central Government Scheme / Programme / Mission" },
      { "prefix": "GOI-FUND", "meaning": "Central Government Fund or Corpus" },
      { "prefix": "IN-{ST}-SCH", "meaning": "State Scheme — ST = ISO 3166-2 state code e.g. IN-MP-SCH" }
    ]
  },
  "scheme_type_values": [
    "centrally_sponsored_scheme",
    "central_sector_scheme",
    "state_scheme",
    "mission",
    "programme",
    "fund",
    "yojana",
    "abhiyan",
    "other"
  ],
  "status_values": [
    "active",
    "discontinued",
    "merged",
    "subsumed",
    "completed",
    "renamed"
  ],
  "entries": [
    {
      "id": "GOI-SCH-MGNREGS",
      "name": { "en": "Mahatma Gandhi National Rural Employment Guarantee Scheme", "hi": "महात्मा गांधी राष्ट्रीय ग्रामीण रोजगार गारंटी योजना" },
      "short_name": { "en": "MGNREGS", "hi": "मनरेगा" },
      "acronym": "MGNREGS",
      "scheme_type": "centrally_sponsored_scheme",
      "sector_function_id": "FUNC-RURAL-DEV",
      "administering_entity_id": "GOI-MIN-RURAL-DEV",
      "jurisdiction": "UNION",
      "state_ut_id": null,
      "launched": "2006-02-02",
      "current_status": "active",
      "active": true,
      "archived": false,
      "dissolution_reason": null,
      "dissolved_on": null,
      "name_history": [
        {
          "name": { "en": "National Rural Employment Guarantee Scheme", "hi": "राष्ट्रीय ग्रामीण रोजगार गारंटी योजना" },
          "acronym": "NREGS",
          "valid_from": "2006-02-02",
          "valid_to": "2009-10-02"
        }
      ],
      "predecessor_ids": [],
      "successor_ids": [],
      "related_ids": [],
      "legislation_code": "ACT-NREGA-2005",
      "notes": { "en": "Renamed from NREGS to MGNREGS on 02 Oct 2009. Guarantees 100 days of wage employment per year to rural households." }
    },
    {
      "id": "GOI-SCH-PMGSY",
      "name": { "en": "Pradhan Mantri Gram Sadak Yojana", "hi": "प्रधानमंत्री ग्राम सड़क योजना" },
      "short_name": { "en": "PMGSY" },
      "acronym": "PMGSY",
      "scheme_type": "centrally_sponsored_scheme",
      "sector_function_id": "FUNC-RURAL-DEV",
      "administering_entity_id": "GOI-MIN-RURAL-DEV",
      "jurisdiction": "UNION",
      "state_ut_id": null,
      "launched": "2000-12-25",
      "current_status": "completed",
      "active": false,
      "archived": false,
      "dissolution_reason": "Phase I objectives completed. Succeeded by PMGSY-II (GOI-SCH-PMGSY-II).",
      "dissolved_on": "2013-05-01",
      "name_history": [],
      "predecessor_ids": [],
      "successor_ids": ["GOI-SCH-PMGSY-II"],
      "related_ids": ["GOI-SCH-PMGSY-II", "GOI-SCH-PMGSY-III"],
      "legislation_code": null,
      "notes": { "en": "Phase I. Focus: connecting unconnected habitations above 500 population (250 in hilly/tribal areas). Reports referencing PMGSY before 2013 refer to this entry." }
    },
    {
      "id": "GOI-SCH-PMGSY-II",
      "name": { "en": "Pradhan Mantri Gram Sadak Yojana Phase II", "hi": "प्रधानमंत्री ग्राम सड़क योजना चरण II" },
      "short_name": { "en": "PMGSY-II" },
      "acronym": "PMGSY-II",
      "scheme_type": "centrally_sponsored_scheme",
      "sector_function_id": "FUNC-RURAL-DEV",
      "administering_entity_id": "GOI-MIN-RURAL-DEV",
      "jurisdiction": "UNION",
      "state_ut_id": null,
      "launched": "2013-05-01",
      "current_status": "completed",
      "active": false,
      "archived": false,
      "dissolution_reason": "Phase II objectives completed. Succeeded by PMGSY-III.",
      "dissolved_on": "2019-07-01",
      "name_history": [],
      "predecessor_ids": ["GOI-SCH-PMGSY"],
      "successor_ids": ["GOI-SCH-PMGSY-III"],
      "related_ids": ["GOI-SCH-PMGSY", "GOI-SCH-PMGSY-III"],
      "legislation_code": null,
      "notes": { "en": "Phase II. Focus: upgradation of existing rural roads. Launched May 2013." }
    },
    {
      "id": "GOI-SCH-PMGSY-III",
      "name": { "en": "Pradhan Mantri Gram Sadak Yojana Phase III", "hi": "प्रधानमंत्री ग्राम सड़क योजना चरण III" },
      "short_name": { "en": "PMGSY-III" },
      "acronym": "PMGSY-III",
      "scheme_type": "centrally_sponsored_scheme",
      "sector_function_id": "FUNC-RURAL-DEV",
      "administering_entity_id": "GOI-MIN-RURAL-DEV",
      "jurisdiction": "UNION",
      "state_ut_id": null,
      "launched": "2019-07-01",
      "current_status": "active",
      "active": true,
      "archived": false,
      "dissolution_reason": null,
      "dissolved_on": null,
      "name_history": [],
      "predecessor_ids": ["GOI-SCH-PMGSY-II"],
      "successor_ids": [],
      "related_ids": ["GOI-SCH-PMGSY", "GOI-SCH-PMGSY-II"],
      "legislation_code": null,
      "notes": { "en": "Phase III. Focus: consolidation of through routes and major rural links. Approved July 2019." }
    },
    {
      "id": "GOI-SCH-RGGVY",
      "name": { "en": "Rajiv Gandhi Grameen Vidyutikaran Yojana", "hi": "राजीव गांधी ग्रामीण विद्युतीकरण योजना" },
      "short_name": { "en": "RGGVY" },
      "acronym": "RGGVY",
      "scheme_type": "centrally_sponsored_scheme",
      "sector_function_id": "FUNC-ENERGY",
      "administering_entity_id": "GOI-MIN-POWER",
      "jurisdiction": "UNION",
      "state_ut_id": null,
      "launched": "2005-04-01",
      "current_status": "merged",
      "active": false,
      "archived": true,
      "dissolution_reason": "Merged into Deen Dayal Upadhyaya Gram Jyoti Yojana (GOI-SCH-DDUGJY) in 2015.",
      "dissolved_on": "2015-12-04",
      "name_history": [],
      "predecessor_ids": [],
      "successor_ids": ["GOI-SCH-DDUGJY"],
      "related_ids": ["GOI-SCH-DDUGJY", "GOI-SCH-RDSS"],
      "legislation_code": null,
      "notes": { "en": "Historical entry. Active 2005–2015. Merged into DDUGJY on 04 Dec 2015." }
    },
    {
      "id": "GOI-SCH-DDUGJY",
      "name": { "en": "Deen Dayal Upadhyaya Gram Jyoti Yojana", "hi": "दीन दयाल उपाध्याय ग्राम ज्योति योजना" },
      "short_name": { "en": "DDUGJY" },
      "acronym": "DDUGJY",
      "scheme_type": "centrally_sponsored_scheme",
      "sector_function_id": "FUNC-ENERGY",
      "administering_entity_id": "GOI-MIN-POWER",
      "jurisdiction": "UNION",
      "state_ut_id": null,
      "launched": "2015-12-04",
      "current_status": "subsumed",
      "active": false,
      "archived": true,
      "dissolution_reason": "Subsumed into Revamped Distribution Sector Scheme (GOI-SCH-RDSS) in 2021.",
      "dissolved_on": "2021-07-31",
      "name_history": [],
      "predecessor_ids": ["GOI-SCH-RGGVY"],
      "successor_ids": ["GOI-SCH-RDSS"],
      "related_ids": ["GOI-SCH-RGGVY", "GOI-SCH-RDSS"],
      "legislation_code": null,
      "notes": { "en": "Historical entry. Active 2015–2021. Subsumed into RDSS in 2021." }
    },
    {
      "id": "GOI-SCH-RDSS",
      "name": { "en": "Revamped Distribution Sector Scheme", "hi": "पुनर्गठित वितरण क्षेत्र योजना" },
      "short_name": { "en": "RDSS" },
      "acronym": "RDSS",
      "scheme_type": "central_sector_scheme",
      "sector_function_id": "FUNC-ENERGY",
      "administering_entity_id": "GOI-MIN-POWER",
      "jurisdiction": "UNION",
      "state_ut_id": null,
      "launched": "2021-07-31",
      "current_status": "active",
      "active": true,
      "archived": false,
      "dissolution_reason": null,
      "dissolved_on": null,
      "name_history": [],
      "predecessor_ids": ["GOI-SCH-DDUGJY"],
      "successor_ids": [],
      "related_ids": ["GOI-SCH-RGGVY", "GOI-SCH-DDUGJY"],
      "legislation_code": null,
      "notes": { "en": "Current scheme for power distribution sector reform. Focus on reducing AT&C losses and improving supply quality." }
    },
    {
      "id": "GOI-SCH-NHM",
      "name": { "en": "National Health Mission", "hi": "राष्ट्रीय स्वास्थ्य मिशन" },
      "short_name": { "en": "NHM" },
      "acronym": "NHM",
      "scheme_type": "centrally_sponsored_scheme",
      "sector_function_id": "FUNC-HEALTH",
      "administering_entity_id": "GOI-MIN-HEALTH",
      "jurisdiction": "UNION",
      "state_ut_id": null,
      "launched": "2013-05-01",
      "current_status": "active",
      "active": true,
      "archived": false,
      "dissolution_reason": null,
      "dissolved_on": null,
      "name_history": [],
      "predecessor_ids": ["GOI-SCH-NRHM"],
      "successor_ids": [],
      "related_ids": ["GOI-SCH-NRHM"],
      "legislation_code": null,
      "notes": { "en": "Expanded from NRHM to NHM in 2013 to include urban health (NUHM). Covers NRHM and NUHM sub-missions." }
    },
    {
      "id": "GOI-SCH-NRHM",
      "name": { "en": "National Rural Health Mission", "hi": "राष्ट्रीय ग्रामीण स्वास्थ्य मिशन" },
      "short_name": { "en": "NRHM" },
      "acronym": "NRHM",
      "scheme_type": "centrally_sponsored_scheme",
      "sector_function_id": "FUNC-HEALTH",
      "administering_entity_id": "GOI-MIN-HEALTH",
      "jurisdiction": "UNION",
      "state_ut_id": null,
      "launched": "2005-04-05",
      "current_status": "subsumed",
      "active": false,
      "archived": true,
      "dissolution_reason": "Subsumed into National Health Mission (GOI-SCH-NHM) as NRHM sub-mission in May 2013.",
      "dissolved_on": "2013-05-01",
      "name_history": [],
      "predecessor_ids": [],
      "successor_ids": ["GOI-SCH-NHM"],